{"$defs":{"recipe":{"additionalProperties":true,"allOf":[{"if":{"properties":{"kind":{"const":"gzip"}},"required":["kind"]},"then":{"properties":{"encoder":{"const":"ogvcs.portable-gzip-fixed-lz77/v1"}},"required":["encoder"]}}],"properties":{"encoder":{"type":"string"},"kind":{"enum":["literal","sha256-counter","source-like-text","structured-records","gzip","insert","replace-window","append"]}},"required":["kind"],"type":"object"}},"$id":"https://schemas.opengamevcs.dev/chunking/v1/selection-benchmark-workloads.schema.json","$schema":"https://json-schema.org/draft/2020-12/schema","additionalProperties":false,"properties":{"profile":{"const":"chunking.opengamevcs/gear-fastcdc-1m@1"},"schemaVersion":{"const":"ogvcs.chunking/selection-benchmark-workloads/v1"},"workloads":{"items":{"additionalProperties":false,"properties":{"baseRecipe":{"$ref":"#/$defs/recipe"},"candidateRecipe":{"$ref":"#/$defs/recipe"},"class":{"enum":["source-like","structured","already-compressed","encrypted/random","insertion","replacement","append"]},"description":{"maxLength":512,"minLength":1,"type":"string"},"mutationKind":{"enum":["replacement","insertion","append"]},"workloadId":{"enum":["source-like","structured","already-compressed","encrypted-random","insertion","replacement","append"]}},"required":["workloadId","class","mutationKind","description","baseRecipe","candidateRecipe"],"type":"object"},"maxItems":7,"minItems":7,"type":"array"},"x-ogvcs-license":{"const":"MIT"}},"required":["schemaVersion","profile","workloads","x-ogvcs-license"],"title":"ChunkingSelectionBenchmarkWorkloads","type":"object","x-ogvcs-license":"MIT"}
