{"profile":"chunking.opengamevcs/gear-fastcdc-1m@1","schemaVersion":"ogvcs.chunking/selection-benchmark-workloads/v1","workloads":[{"baseRecipe":{"editLineCount":0,"editStartLine":0,"kind":"source-like-text","lines":220000,"salt":0},"candidateRecipe":{"editLineCount":3000,"editStartLine":90000,"kind":"source-like-text","lines":220000,"salt":11},"class":"source-like","description":"Fixed-width source-like text with a bounded edited line window that preserves an exact suffix.","mutationKind":"replacement","workloadId":"source-like"},{"baseRecipe":{"editRecordCount":0,"editStartRecord":0,"kind":"structured-records","records":220000,"salt":0},"candidateRecipe":{"editRecordCount":2200,"editStartRecord":58000,"kind":"structured-records","records":220000,"salt":19},"class":"structured","description":"Fixed-width structured records with a bounded edited record window that keeps chunk boundaries stable.","mutationKind":"replacement","workloadId":"structured"},{"baseRecipe":{"kind":"gzip","source":{"editLineCount":0,"editStartLine":0,"kind":"source-like-text","lines":220000,"salt":0}},"candidateRecipe":{"kind":"gzip","source":{"editLineCount":3000,"editStartLine":90000,"kind":"source-like-text","lines":220000,"salt":11}},"class":"already-compressed","description":"Deterministic gzip of the source-like corpus to show that small logical edits can still yield poor chunk reuse after compression.","mutationKind":"replacement","workloadId":"already-compressed"},{"baseRecipe":{"kind":"sha256-counter","length":6291456,"seed":"random-base-a"},"candidateRecipe":{"kind":"sha256-counter","length":6291456,"seed":"random-base-b"},"class":"encrypted/random","description":"Two equal-length pseudorandom byte streams with independent seeds and no expected reuse.","mutationKind":"replacement","workloadId":"encrypted-random"},{"baseRecipe":{"kind":"sha256-counter","length":5242880,"seed":"insertion-base"},"candidateRecipe":{"base":{"kind":"sha256-counter","length":5242880,"seed":"insertion-base"},"hex":"00112233445566778899aabbccddeeff42","kind":"insert","offset":1048593},"class":"insertion","description":"The bounded golden insertion pair exercises boundary re-synchronization after a 17-byte insert near the 1 MiB target.","mutationKind":"insertion","workloadId":"insertion"},{"baseRecipe":{"kind":"sha256-counter","length":5242880,"seed":"replacement-base"},"candidateRecipe":{"base":{"kind":"sha256-counter","length":5242880,"seed":"replacement-base"},"kind":"replace-window","offset":1048593,"replacement":{"kind":"sha256-counter","length":524288,"seed":"replacement-window"}},"class":"replacement","description":"A fixed-length replacement window near the 1 MiB target measures reuse after an in-place rewrite.","mutationKind":"replacement","workloadId":"replacement"},{"baseRecipe":{"kind":"sha256-counter","length":4194304,"seed":"append-base"},"candidateRecipe":{"base":{"kind":"sha256-counter","length":4194304,"seed":"append-base"},"kind":"append","suffix":{"kind":"sha256-counter","length":786432,"seed":"append-suffix"}},"class":"append","description":"A deterministic suffix append isolates reused prefix chunks from newly required tail bytes.","mutationKind":"append","workloadId":"append"}],"x-ogvcs-license":"MIT"}
